{
  "schema_version": 1,
  "provider": "seedream",
  "parameters": {},
  "references": [],
  "routes": [
    {
      "requirement": "identity",
      "via": "prompt"
    },
    {
      "requirement": "readability",
      "via": "prompt"
    },
    {
      "requirement": "size",
      "via": "postprocess",
      "reason": "Export a small preview after generation.",
      "check": "Inspect the actual 32-pixel display on the target UI background."
    }
  ],
  "review": {
    "reviewer": "Set the actual reviewer",
    "notes": "Review the actual request before marking these checks complete.",
    "brief_accounted_for": false,
    "requirements_preserved": false,
    "no_unrequested_features": false,
    "reference_roles_checked": false
  }
}
